{
  "$schema": "https://json-schema.org/draft/2020-12/schema",
  "$id": "playback-status.schema.json",
  "title": "Playback Status Evidence",
  "description": "Schema for Display Client playback smoke evidence collected during Streaming Lab test runs.",
  "type": "object",
  "additionalProperties": false,
  "required": [
    "testRunId",
    "displayId",
    "streamUrl",
    "sourceId",
    "playbackMode",
    "playbackStatus",
    "readyState",
    "videoWidth",
    "videoHeight",
    "currentTimeSeconds",
    "autoplay",
    "muted",
    "lastError",
    "errorType",
    "errorDetails",
    "fatalError",
    "capturedAt",
    "evidenceType",
    "screenshotPath"
  ],
  "properties": {
    "testRunId": {
      "type": "string",
      "minLength": 1,
      "description": "Unique identifier for the test run that produced this evidence."
    },
    "displayId": {
      "type": "string",
      "minLength": 1,
      "description": "Identifier for the browser display instance, such as DISPLAY_01."
    },
    "streamUrl": {
      "type": "string",
      "format": "uri",
      "description": "HLS stream URL assigned to the Display Client."
    },
    "sourceId": {
      "type": "string",
      "minLength": 1,
      "description": "Logical stream/source identifier, such as camera_sync_test."
    },
    "playbackMode": {
      "type": "string",
      "enum": ["hls.js", "native-hls", "unknown"],
      "description": "Playback implementation used by the browser client."
    },
    "playbackStatus": {
      "type": "string",
      "enum": ["PLAYING", "PAUSED", "WAITING", "ERROR", "UNKNOWN"],
      "description": "Observed playback status at capture time."
    },
    "readyState": {
      "type": "integer",
      "minimum": 0,
      "maximum": 4,
      "description": "HTMLMediaElement readyState value."
    },
    "videoWidth": {
      "type": "integer",
      "minimum": 0,
      "description": "Observed video width in pixels."
    },
    "videoHeight": {
      "type": "integer",
      "minimum": 0,
      "description": "Observed video height in pixels."
    },
    "currentTimeSeconds": {
      "type": "number",
      "minimum": 0,
      "description": "Current playback time reported by the browser video element."
    },
    "autoplay": {
      "type": "boolean",
      "description": "Whether autoplay was enabled for this playback session."
    },
    "muted": {
      "type": "boolean",
      "description": "Whether the video element was muted during playback."
    },
    "lastError": {
      "type": ["string", "null"],
      "description": "Last playback or HLS error message, if any."
    },
    "errorType": {
      "type": ["string", "null"],
      "description": "Error category reported by the playback layer, if any."
    },
    "errorDetails": {
      "type": ["string", "null"],
      "description": "Additional error details reported by the playback layer, if any."
    },
    "fatalError": {
      "type": ["boolean", "null"],
      "description": "Whether the playback error was fatal, if known."
    },
    "capturedAt": {
      "type": "string",
      "format": "date-time",
      "description": "Timestamp when the evidence was captured."
    },
    "evidenceType": {
      "type": "string",
      "enum": ["manual-playback-smoke", "automated-playback-smoke"],
      "description": "Type of evidence collection that produced this file."
    },
    "screenshotPath": {
      "type": "string",
      "minLength": 1,
      "description": "Relative path to the screenshot associated with this playback status evidence."
    }
  }
}
