{
  "testRunId": "manual-smoke-display-01",
  "displayId": "DISPLAY_01",
  "streamUrl": "http://localhost:8888/camera_sync_test/index.m3u8",
  "sourceId": "camera_sync_test",
  "playbackMode": "hls.js",
  "playbackStatus": "PLAYING",
  "readyState": 4,
  "videoWidth": 1280,
  "videoHeight": 720,
  "currentTimeSeconds": 86.11,
  "autoplay": true,
  "muted": true,
  "lastError": null,
  "errorType": null,
  "errorDetails": null,
  "fatalError": null,
  "capturedAt": "2026-06-18T00:00:00Z",
  "evidenceType": "manual-playback-smoke",
  "screenshotPath": "screenshot.png"
}
